{"metadata":{"usedHelpers":[],"marked":[],"modules":{"imports":[{"source":"meteor/mongo","imported":["Mongo"],"specifiers":[{"kind":"named","imported":"Mongo","local":"Mongo"}]},{"source":"meteor/meteor","imported":["Meteor"],"specifiers":[{"kind":"named","imported":"Meteor","local":"Meteor"}]}],"exports":{"exported":["PoliceStation"],"specifiers":[{"kind":"local","local":"PoliceStation","exported":"PoliceStation"}]}}},"options":{"filename":"imports/dashboard/forms/api/PoliceStation.js","filenameRelative":"imports/dashboard/forms/api/PoliceStation.js","env":{"development":{"plugins":[]}},"retainLines":false,"highlightCode":true,"suppressDeprecationMessages":false,"presets":[],"plugins":[[[],null],[[],null],[[],null],[[],null],[[],null],[[],null],[[],{"generateLetDeclarations":true,"enforceStrictMode":false}],[[],{"polyfill":false}],[[],null],[[],null],[[],null],[[],{"useNativeAsyncAwait":false}],[[],null],[[],null],[[],{"allowTopLevelThis":true,"strict":false,"loose":true}]],"ignore":[],"code":true,"metadata":true,"ast":true,"comments":true,"compact":false,"minified":false,"sourceMap":true,"sourceMaps":true,"sourceMapTarget":"imports/dashboard/forms/api/PoliceStation.js.map","sourceFileName":"imports/dashboard/forms/api/PoliceStation.js","babelrc":false,"sourceType":"module","moduleIds":false,"passPerPreset":false,"parserOpts":false,"generatorOpts":false,"basename":"PoliceStation"},"ignored":false,"code":"module.export({\n  PoliceStation: () => PoliceStation\n});\nlet Mongo;\nmodule.watch(require(\"meteor/mongo\"), {\n  Mongo(v) {\n    Mongo = v;\n  }\n\n}, 0);\nlet Meteor;\nmodule.watch(require(\"meteor/meteor\"), {\n  Meteor(v) {\n    Meteor = v;\n  }\n\n}, 1);\nconst PoliceStation = new Mongo.Collection(\"policeStation\");\n\nif (Meteor.isServer) {\n  Meteor.publish('policeStation', () => {\n    return PoliceStation.find({});\n  });\n  Meteor.publish('singlePoliceStation', id => {\n    return PoliceStation.find({\n      \"_id\": id\n    });\n  });\n  Meteor.methods({\n    'createPoliceStation': function (policeStationName, policeStationAddressLine1, policeStationAddressLine2, policeStationAddressLine3, country, state, city, area, pinCode) {\n      PoliceStation.insert({\n        'policeStationName': policeStationName,\n        'policeStationAddressLine1': policeStationAddressLine1,\n        'policeStationAddressLine2': policeStationAddressLine2,\n        'policeStationAddressLine3': policeStationAddressLine3,\n        'country': country,\n        'state': state,\n        'city': city,\n        'area': area,\n        'pinCode': pinCode,\n        'createdAt': new Date()\n      });\n    },\n    'updatePoliceStation': function (id, policeStationName, policeStationAddressLine1, policeStationAddressLine2, policeStationAddressLine3, country, state, city, area, pinCode) {\n      PoliceStation.update({\n        \"_id\": id\n      }, {\n        $set: {\n          'policeStationName': policeStationName,\n          'policeStationAddressLine1 ': policeStationAddressLine1,\n          'policeStationAddressLine2': policeStationAddressLine2,\n          'policeStationAddressLine3': policeStationAddressLine3,\n          'country': country,\n          'state': state,\n          'city': city,\n          'area': area,\n          'pinCode': pinCode\n        }\n      });\n    },\n    'deletePoliceStation': function (id) {\n      PoliceStation.remove({\n        \"_id\": id\n      });\n    }\n  });\n}","map":{"version":3,"sources":["imports/dashboard/forms/api/PoliceStation.js"],"names":["module","export","PoliceStation","Mongo","watch","require","v","Meteor","Collection","isServer","publish","find","id","methods","policeStationName","policeStationAddressLine1","policeStationAddressLine2","policeStationAddressLine3","country","state","city","area","pinCode","insert","Date","update","$set","remove"],"mappings":"AAAAA,OAAOC,MAAP,CAAc;AAACC,iBAAc,MAAIA;AAAnB,CAAd;AAAiD,IAAIC,KAAJ;AAAUH,OAAOI,KAAP,CAAaC,QAAQ,cAAR,CAAb,EAAqC;AAACF,QAAMG,CAAN,EAAQ;AAACH,YAAMG,CAAN;AAAQ;;AAAlB,CAArC,EAAyD,CAAzD;AAA4D,IAAIC,MAAJ;AAAWP,OAAOI,KAAP,CAAaC,QAAQ,eAAR,CAAb,EAAsC;AAACE,SAAOD,CAAP,EAAS;AAACC,aAAOD,CAAP;AAAS;;AAApB,CAAtC,EAA4D,CAA5D;AAG3H,MAAMJ,gBAAgB,IAAIC,MAAMK,UAAV,CAAqB,eAArB,CAAtB;;AAEP,IAAGD,OAAOE,QAAV,EAAmB;AAChBF,SAAOG,OAAP,CAAe,eAAf,EAA+B,MAAI;AAC/B,WAAOR,cAAcS,IAAd,CAAmB,EAAnB,CAAP;AACH,GAFD;AAGAJ,SAAOG,OAAP,CAAe,qBAAf,EAAsCE,EAAD,IAAM;AACvC,WAAOV,cAAcS,IAAd,CAAmB;AAAC,aAAMC;AAAP,KAAnB,CAAP;AACH,GAFD;AAIDL,SAAOM,OAAP,CAAe;AACZ,2BAAsB,UAASC,iBAAT,EAA2BC,yBAA3B,EAAqDC,yBAArD,EAA+EC,yBAA/E,EAAyGC,OAAzG,EAAiHC,KAAjH,EAAuHC,IAAvH,EAA4HC,IAA5H,EAAiIC,OAAjI,EAAyI;AAC9JpB,oBAAcqB,MAAd,CAAqB;AACjB,6BAA8BT,iBADb;AAEjB,qCAA8BC,yBAFb;AAGjB,qCAA8BC,yBAHb;AAIjB,qCAA8BC,yBAJb;AAKjB,mBAA8BC,OALb;AAMjB,iBAA8BC,KANb;AAOjB,gBAA8BC,IAPb;AAQjB,gBAA8BC,IARb;AASjB,mBAA8BC,OATb;AAUjB,qBAA8B,IAAIE,IAAJ;AAVb,OAArB;AAYC,KAdU;AAeX,2BAAsB,UAASZ,EAAT,EAAYE,iBAAZ,EAA8BC,yBAA9B,EAAwDC,yBAAxD,EAAkFC,yBAAlF,EAA4GC,OAA5G,EAAoHC,KAApH,EAA0HC,IAA1H,EAA+HC,IAA/H,EAAoIC,OAApI,EAA4I;AAChKpB,oBAAcuB,MAAd,CAAqB;AAAC,eAAMb;AAAP,OAArB,EACE;AAACc,cAAK;AACJ,+BAA8BZ,iBAD1B;AAEJ,wCAA8BC,yBAF1B;AAGJ,uCAA8BC,yBAH1B;AAIJ,uCAA8BC,yBAJ1B;AAKJ,qBAA8BC,OAL1B;AAMJ,mBAA8BC,KAN1B;AAOJ,kBAA8BC,IAP1B;AAQJ,kBAA8BC,IAR1B;AASJ,qBAA8BC;AAT1B;AAAN,OADF;AAYD,KA5BU;AA6BX,2BAAsB,UAASV,EAAT,EAAY;AAChCV,oBAAcyB,MAAd,CAAqB;AAAC,eAAMf;AAAP,OAArB;AACD;AA/BU,GAAf;AAkCD","file":"imports/dashboard/forms/api/PoliceStation.js.map","sourcesContent":["import {Mongo} from 'meteor/mongo';\nimport {Meteor} from 'meteor/meteor';\n\nexport const PoliceStation = new Mongo.Collection(\"policeStation\");\n\nif(Meteor.isServer){\n   Meteor.publish('policeStation',()=>{\n       return PoliceStation.find({});\n   });\n   Meteor.publish('singlePoliceStation',(id)=>{\n       return PoliceStation.find({\"_id\":id});\n   });   \n\n\t Meteor.methods({\n\t \t \t'createPoliceStation':function(policeStationName,policeStationAddressLine1,policeStationAddressLine2,policeStationAddressLine3,country,state,city,area,pinCode){\n    \t\tPoliceStation.insert({\n          'policeStationName'         : policeStationName,\n          'policeStationAddressLine1' : policeStationAddressLine1,\n          'policeStationAddressLine2' : policeStationAddressLine2,\n          'policeStationAddressLine3' : policeStationAddressLine3,\n          'country'                   : country,\n          'state'                     : state,\n          'city'                      : city,\n          'area'                      : area,\n          'pinCode'                   : pinCode,\n          'createdAt'                 : new Date(),\n    \t\t}); \n      },\n      'updatePoliceStation':function(id,policeStationName,policeStationAddressLine1,policeStationAddressLine2,policeStationAddressLine3,country,state,city,area,pinCode){\n        PoliceStation.update({\"_id\":id},\n          {$set:{\n            'policeStationName'         : policeStationName,\n            'policeStationAddressLine1 ': policeStationAddressLine1,\n            'policeStationAddressLine2' : policeStationAddressLine2,\n            'policeStationAddressLine3' : policeStationAddressLine3,\n            'country'                   : country,\n            'state'                     : state,\n            'city'                      : city,\n            'area'                      : area,\n            'pinCode'                   : pinCode, \n          }});\n      },\n      'deletePoliceStation':function(id){\n        PoliceStation.remove({\"_id\":id});\n      }\n\t });\n\n}\n"]},"hash":"007e1979ba5c3aa30901c238e802a95e20c33b48"}
